{
  "$schema": "http://json-schema.org/draft-07/schema#",
  "$id": "https://pentest-skill-v2/summary.schema.json",
  "title": "summary.json",
  "type": "object",
  "additionalProperties": false,
  "required": [
    "target",
    "scan_start",
    "scan_end",
    "test_accounts",
    "role_pair_matrix",
    "confirmed_vulns"
  ],
  "properties": {
    "target": {
      "$ref": "common.schema.json#/definitions/absolute_uri"
    },
    "scan_start": {
      "$ref": "common.schema.json#/definitions/date_time"
    },
    "scan_end": {
      "$ref": "common.schema.json#/definitions/date_time"
    },
    "test_accounts": {
      "type": "array",
      "items": {
        "type": "object",
        "required": [
          "role",
          "username",
          "user_id",
          "purpose"
        ],
        "properties": {
          "role": {
            "type": "string"
          },
          "username": {
            "type": "string"
          },
          "user_id": {
            "$ref": "common.schema.json#/definitions/user_id"
          },
          "purpose": {
            "type": "string"
          }
        },
        "additionalProperties": false
      }
    },
    "role_pair_matrix": {
      "type": "array",
      "items": {
        "type": "object",
        "required": [
          "attacker",
          "victim",
          "tested"
        ],
        "properties": {
          "attacker": {
            "type": "string"
          },
          "victim": {
            "type": "string"
          },
          "tested": {
            "type": "boolean"
          },
          "use_case": {
            "type": "string"
          }
        },
        "additionalProperties": false
      }
    },
    "session_pool_limitation": {
      "type": [
        "string",
        "null"
      ],
      "enum": [
        null,
        "single_account",
        "no_account"
      ]
    },
    "confirmed_vulns": {
      "type": "array",
      "items": {
        "type": "object",
        "required": [
          "id",
          "module_id",
          "module",
          "feature_id",
          "feature_name",
          "threat_id",
          "vuln_type",
          "risk_level",
          "access_path"
        ],
        "properties": {
          "id": {
            "$ref": "common.schema.json#/definitions/finding_id"
          },
          "module_id": {
            "type": "string",
            "pattern": "^[a-z0-9_]+$"
          },
          "module": {
            "type": "string"
          },
          "feature_id": {
            "type": "string"
          },
          "feature_name": {
            "type": "string"
          },
          "threat_id": {
            "type": "string",
            "pattern": "^T[0-9]+$"
          },
          "vuln_type": {
            "type": "string"
          },
          "risk_level": {
            "type": "string",
            "enum": [
              "critical",
              "high",
              "medium",
              "low",
              "info"
            ]
          },
          "access_path": {
            "type": "array"
          },
          "cvss": {
            "type": "string",
            "description": "Optional. Quantified severity, such as '8.1 High (AV:N/AC:L/PR:L/UI:N/S:U/C:H/I:H/A:N)'. Added by the model during reporting and not used for validation."
          },
          "fix_advice": {
            "type": [
              "string",
              "object"
            ],
            "description": "Optional. Remediation guidance added by the model during reporting. Object form may use short_term / long_term. Not used for validation."
          }
        },
        "additionalProperties": false
      }
    }
  }
}
