{
  "target": "https://target.example.com",
  "scan_start": "2026-07-12T09:00:00+08:00",
  "scan_end": "2026-07-12T11:00:00+08:00",
  "test_accounts": [
    {
      "role": "user1",
      "username": "user1",
      "user_id": 101,
      "purpose": "Standard-user testing"
    }
  ],
  "role_pair_matrix": [],
  "session_pool_limitation": "single_account",
  "confirmed_vulns": [
    {
      "id": "VULN-001",
      "module_id": "demo",
      "module": "Demo Module",
      "feature_id": "demo_feature_001",
      "feature_name": "View Demo Object",
      "threat_id": "T1",
      "vuln_type": "Missing Object-Ownership Validation",
      "risk_level": "high",
      "access_path": [
        {
          "step": 1,
          "action": "Log in"
        },
        {
          "step": 2,
          "action": "Open the demo page",
          "url": "https://target.example.com/demo"
        }
      ],
      "cvss": "8.1 High",
      "fix_advice": "Validate object ownership at the final read point."
    }
  ]
}
